"DOI","Title","Authors","Author_Affiliations","Corresponding_Author","Corresponding_Authors_Email","Publication_Date","Abstract","Keywords","Full_Text"
"https://doi.org/10.1534/g3.113.006254 ","Major Histocompatibility Complex Class I Haplotype Diversity in Chinese Rhesus Macaques","Julie A. Karl, Patrick S. Bohn, Roger W. Wiseman, Francesca A. Nimityongskul, Simon M. Lank, Gabriel J. Starrett and David H. O’Connor","*Wisconsin National Primate Research Center, University of Wisconsin-Madison, Madison, Wisconsin 53715//†Department of Pathology and Laboratory Medicine, University of Wisconsin-Madison, Madison, Wisconsin 53705","<U+21B5>1Corresponding author: Department of Pathology and Laboratory Medicine, University of Wisconsin-Madison, 555 Science Drive, Madison, WI 53711. E-mail: doconnor{at}primate.wisc.edu","doconnor@primate.wisc.edu","July 1, 2013 ","AbstractThe use of Chinese-origin rhesus macaques (Macaca mulatta) for infectious disease immunity research is increasing despite the relative lack of major histocompatibility complex (MHC) class I immunogenetics information available for this population. We determined transcript-based MHC class I haplotypes for 385 Chinese rhesus macaques from five different experimental cohorts, providing a concise representation of the full complement of MHC class I major alleles expressed by each animal. In total, 123 Mamu-A and Mamu-B haplotypes were defined in the full Chinese rhesus macaque cohort. We then performed an analysis of haplotype frequencies across the experimental cohorts of Chinese rhesus macaques, as well as a comparison against a group of 96 Indian rhesus macaques. Notably, 35 of the 51 Mamu-A and Mamu-B haplotypes observed in Indian rhesus macaques were also detected in the Chinese population, with 85% of the 385 Chinese-origin rhesus macaques expressing at least one of these class I haplotypes. This unexpected conservation of Indian rhesus macaque MHC class I haplotypes in the Chinese rhesus macaque population suggests that immunologic insights originally gleaned from studies using Indian rhesus macaques may be more applicable to Chinese rhesus macaques than previously appreciated and may provide an opportunity for studies of CD8+ T-cell responses between populations. It may also be possible to extend these studies across multiple species of macaques, as we found evidence of shared ancestral haplotypes between Chinese rhesus and Mauritian cynomolgus macaques.","Macaca,mulatta,MHC,class,I,RNA,transcript-based,haplotypes,immunogenetics","https://www.g3journal.org/content/3/7/1195.full"
"https://doi.org/10.1534/g3.119.400541 ","Expression-Based Cell Lineage Analysis in Drosophila Through a Course-Based Research Experience for Early Undergraduates","John M. Olson, Cory J. Evans, Kathy T. Ngo, Hee Jong Kim, Joseph Duy Nguyen, Kayla G. H. Gurley, Truc Ta, Vijay Patel, Lisa Han, Khoa T. Truong-N, Letty Liang, Maggie K. Chu, Hiu Lam, Hannah G. Ahn, Abhik Kumar Banerjee, In Young Choi, Ross G. Kelley, Naseem Moridzadeh, Awais M. Khan, Omair Khan, Szuyao Lee, Elizabeth B. Johnson, Annie Tigranyan, Jay Wang, Anand D. Gandhi, Manish M. Padhiar, Joseph Hargan Calvopina, Kirandeep Sumra, Kristy Ou, Jessie C. Wu, Joseph N. Dickan, Sabrena M. Ahmadi, Donald N. Allen, Van Thanh Mai, Saif Ansari, George Yeh, Earl Yoon, Kimberly Gon, John Y. Yu, Johnny He, Jesse M. Zaretsky, Noemi E. Lee, Edward Kuoy, Alexander N. Patananan, Daniel Sitz, PhuongThao Tran, Minh-Tu Do, Samira J. Akhave, Silverio D. Alvarez, Bobby Asem, Neda Asem, Nicole A. Azarian, Arezou Babaesfahani, Ahmad Bahrami, Manjeet Bhamra, Ragini Bhargava, Rakesh Bhatia, Subir Bhatia, Nicholas Bumacod, Jonathan J. Caine, Thomas A. Caldwell, Nicole A. Calica, Elise M. Calonico, Carman Chan, Helen H.-L. Chan, Albert Chang, Chiaen Chang, Daniel Chang, Jennifer S. Chang, Nauman Charania, Jasmine Y. Chen, Kevin Chen, Lu Chen, Yuyu Chen, Derek J. Cheung, Jesse J. Cheung, Jessica J. Chew, Nicole B. Chew, Cheng-An Tony Chien, Alana M. Chin, Chee Jia Chin, Youngho Cho, Man Ting Chou, Ke-Huan K. Chow, Carolyn Chu, Derrick M. Chu, Virginia Chu, Katherine Chuang, Arunit Singh Chugh, Mark R. Cubberly, Michael Guillermo Daniel, Sangita Datta, Raj Dhaliwal, Jenny Dinh, Dhaval Dixit, Emmylou Dowling, Melinda Feng, Christopher M. From, Daisuke Furukawa, Himaja Gaddipati, Lilit Gevorgyan, Zunera Ghaznavi, Tulika Ghosh, Jaskaran Gill, David J. Groves, Kalkidan K. Gurara, Ali R. Haghighi, Alexandra L. Havard, Nasser Heyrani, Tanya Hioe, Kirim Hong, Justin J. Houman, Molly Howland, Elaine L. Hsia, Justin Hsueh, Stacy Hu, Andrew J. Huang, Jasmine C. Huynh, Jenny Huynh, Chris Iwuchukwu, Michael J. Jang, An An Jiang, Simran Kahlon, Pei-Yun Kao, Manpreet Kaur, Matthew G. Keehn, Elizabeth J. Kim, Hannah Kim, Michelle J. Kim, Shawn J. Kim, Aleksandar Kitich, Ross A. Kornberg, Nicholas G. Kouzelos, Jane Kuon, Bryan Lau, Roger K. Lau, Rona Law, Huy D. Le, Rachael Le, Carrou Lee, Christina Lee, Grace E. Lee, Kenny Lee, Michelle J. Lee, Regina V. Lee, Sean H. K. Lee, Sung Kyu Lee, Sung-Ling D. Lee, Yong Jun Lee, Megan J. Leong, David M. Li, Hao Li, Xingfu Liang, Eric Lin, Michelle M. Lin, Peter Lin, Tiffany Lin, Stacey Lu, Serena S. Luong, Jessica S. Ma, Li Ma, Justin N. Maghen, Sravya Mallam, Shivtaj Mann, Jason H. Melehani, Ryan C. Miller, Nitish Mittal, Carmel M. Moazez, Susie Moon, Rameen Moridzadeh, Kaley Ngo, Hanh H. Nguyen, Kambria Nguyen, Thien H. Nguyen, Angela W. Nieh, Isabella Niu, Seo-Kyung Oh, Jessica R. Ong, Randi K. Oyama, Joseph Park, Yaelim A. Park, Kimberly A. Passmore, Ami Patel, Amy A. Patel, Dhruv Patel, Tirth Patel, Katherine E. Peterson, An Huynh Pham, Steven V. Pham, Melissa E. Phuphanich, Neil D. Poria, Alexandra Pourzia, Victoria Ragland, Riki D. Ranat, Cameron M. Rice, David Roh, Solomon Rojhani, Lili Sadri, Agafe Saguros, Zainab Saifee, Manjot Sandhu, Brooke Scruggs, Lisa M. Scully, Vanessa Shih, Brian A. Shin, Tamir Sholklapper, Harnek Singh, Sumedha Singh, Sondra L. Snyder, Katelyn F. Sobotka, Sae Ho Song, Siddharth Sukumar, Halley C. Sullivan, Mark Sy, Hande Tan, Sara K. Taylor, Shivani K. Thaker, Tulsi Thakore, Gregory E. Tong, Jacinda N. Tran, Jonathan Tran, Tuan D. Tran, Vivi Tran, Cindy L. Trang, Hung G. Trinh, Peter Trinh, Han-Ching H. Tseng, Ted T. Uotani, Akram V. Uraizee, Kent K. T. Vu, Kevin K. T. Vu, Komal Wadhwani, Paluk K. Walia, Rebecca S. Wang, Shuo Wang, Stephanie J. Wang, Danica D. Wiredja, Andrew L. Wong, Daniel Wu, Xi Xue, Griselda Yanez, Yung-Hsuan Yang, Zhong Ye, Victor W. Yee, Cynthia Yeh, Yue Zhao, Xin Zheng, Anke Ziegenbalg, Jon Alkali, Ida Azizkhanian, Akash Bhakta, Luke Berry, Ryen Castillo, Sonja Darwish, Holly Dickinson, Ritika Dutta, Rahul Kumar Ghosh, Riley Guerin, Jonathan Hofman, Garrick Iwamoto, Sarah Kang, Andrew Kim, Brian Kim, Hanwool Kim, Kristine Kim, Suji Kim, Julie Ko, Michael Koenig, Alejandro LaRiviere, Clifton Lee, Jiwon Lee, Brandon Lung, Max Mittelman, Mark Murata, Yujin Park, Daniel Rothberg, Ben Sprung-Keyser, Kunal Thaker, Vivian Yip, Paul Picard, Francie Diep, Nikki Villarasa, Volker Hartenstein, Casey Shapiro, Marc Levis-Fitzgerald, Leslie Jaworski, David Loppato, Ira E. Clark and Utpal Banerjee","*Department of Molecular, Cell and Developmental Biology, University of California, Los Angeles, Los Angeles, CA 90095//†Biomedical Research Minor, University of California, Los Angeles//‡Loyola High School, Los Angeles, CA 90006//§Center for the Advancement of Teaching, University of California, Los Angeles, and//**Department of Psychology, Grinnell College, Grinnell, IA 50112","<U+21B5>4Corresponding authors: Department of Biology, Loyola Marymount University, 1 LMU Drive, Los Angeles, CA 90045, E-mail: Cory.Evans{at}lmu.edu. Department of Molecular, Cell, and Developmental Biology, University of California, Los Angeles, Los Angeles, CA 90095 Mail Code 723905. E-mail: banerjee{at}mbi.ucla.edu","Cory.Evans@lmu.edu.,banerjee@mbi.ucla.edu","November 1, 2019 ","AbstractA variety of genetic techniques have been devised to determine cell lineage relationships during tissue development. Some of these systems monitor cell lineages spatially and/or temporally without regard to gene expression by the cells, whereas others correlate gene expression with the lineage under study. The GAL4 Technique for Real-time and Clonal Expression (G-TRACE) system allows for rapid, fluorescent protein-based visualization of both current and past GAL4 expression patterns and is therefore amenable to genome-wide expression-based lineage screens. Here we describe the results from such a screen, performed by undergraduate students of the University of California, Los Angeles (UCLA) Undergraduate Research Consortium for Functional Genomics (URCFG) and high school summer scholars as part of a discovery-based education program. The results of the screen, which reveal novel expression-based lineage patterns within the brain, the imaginal disc epithelia, and the hematopoietic lymph gland, have been compiled into the G-TRACE Expression Database (GED), an online resource for use by the Drosophila research community. The impact of this discovery-based research experience on student learning gains was assessed independently and shown to be greater than that of similar programs conducted elsewhere. Furthermore, students participating in the URCFG showed considerably higher STEM retention rates than UCLA STEM students that did not participate in the URCFG, as well as STEM students nationwide.","G-TRACE,gene,expression,education,STEM,CURE","https://www.g3journal.org/content/9/11/3791.full"
"https://doi.org/10.1534/g3.116.027961 ","Sex Differences in Drosophila Somatic Gene Expression: Variation and Regulation by doublesex"," View ORCID ProfileMichelle N. Arbeitman, Felicia N. New, Justin M. Fear, Tiffany S. Howard, Justin E. Dalton and  View ORCID ProfileRita M. Graze","*Biomedical Sciences Department and Center for Genomics and Personalized Medicine, Florida State University, College of Medicine, Tallahassee, Florida 32306//†Department of Molecular Genetics and Microbiology, University of Florida, Gainesville, Florida 32610-0266//‡Department of Biological Sciences, Auburn University, Alabama 36849","<U+21B5>1Corresponding authors: Department of Biomedical Sciences, Florida State University, 1115 West Call Street, Tallahassee, FL 32306. E-mail: michelle.arbeitman{at}med.fsu.edu; and Department of Biological Sciences, 101 Rouse Life Sciences building, Auburn University, AL 36849-5407. E-mail: rmgraze{at}auburn.edu","michelle.arbeitman@med.fsu.edu;,rmgraze@auburn.edu","July 1, 2016 ","AbstractSex differences in gene expression have been widely studied in Drosophila melanogaster. Sex differences vary across strains, but many molecular studies focus on only a single strain, or on genes that show sexually dimorphic expression in many strains. How extensive variability is and whether this variability occurs among genes regulated by sex determination hierarchy terminal transcription factors is unknown. To address these questions, we examine differences in sexually dimorphic gene expression between two strains in Drosophila adult head tissues. We also examine gene expression in doublesex (dsx) mutant strains to determine which sex-differentially expressed genes are regulated by DSX, and the mode by which DSX regulates expression. We find substantial variation in sex-differential expression. The sets of genes with sexually dimorphic expression in each strain show little overlap. The prevalence of different DSX regulatory modes also varies between the two strains. Neither the patterns of DSX DNA occupancy, nor mode of DSX regulation explain why some genes show consistent sex-differential expression across strains. We find that the genes identified as regulated by DSX in this study are enriched with known sites of DSX DNA occupancy. Finally, we find that sex-differentially expressed genes and genes regulated by DSX are highly enriched on the fourth chromosome. These results provide insights into a more complete pool of potential DSX targets, as well as revealing the molecular flexibility of DSX regulation.","sex,determination,Drosophila,sex,hierarchy,doublesex,transcriptome,gene,expression,sex,bias,RNA-seq,Genetics,of,Sex","https://www.g3journal.org/content/6/7/1799.full"
"https://doi.org/10.1534/g3.111.000240 ","Stacks: Building and Genotyping Loci De Novo From Short-Read Sequences","Julian M. Catchen, Angel Amores, Paul Hohenlohe, William Cresko and John H. Postlethwait","*Center for Ecology and Evolutionary Biology//†Institute of Neuroscience, University of Oregon, Eugene, Oregon 97403","<U+21B5>1Corresponding author: Institute of Neuroscience, University of Oregon, Eugene, OR 97403. E-mail: jpostle{at}uoregon.edu","jpostle@uoregon.edu","August 1, 2011 ","AbstractAdvances in sequencing technology provide special opportunities for genotyping individuals with speed and thrift, but the lack of software to automate the calling of tens of thousands of genotypes over hundreds of individuals has hindered progress. Stacks is a software system that uses short-read sequence data to identify and genotype loci in a set of individuals either de novo or by comparison to a reference genome. From reduced representation Illumina sequence data, such as RAD-tags, Stacks can recover thousands of single nucleotide polymorphism (SNP) markers useful for the genetic analysis of crosses or populations. Stacks can generate markers for ultra-dense genetic linkage maps, facilitate the examination of population phylogeography, and help in reference genome assembly. We report here the algorithms implemented in Stacks and demonstrate their efficacy by constructing loci from simulated RAD-tags taken from the stickleback reference genome and by recapitulating and improving a genetic map of the zebrafish, Danio rerio.","Illumina,meiotic,linkage,map,RAD-seq,RAD-tag,zebrafish","https://www.g3journal.org/content/1/3/171.full"
"https://doi.org/10.1534/g3.119.400781 ","Rapid Degradation of Caenorhabditis elegans Proteins at Single-Cell Resolution with a Synthetic Auxin"," View ORCID ProfileMichael A. Q. Martinez, Brian A. Kinney,  View ORCID ProfileTaylor N. Medwig-Kinney, Guinevere Ashley, James M. Ragle,  View ORCID ProfileLonden Johnson,  View ORCID ProfileJoseph Aguilera, Christopher M. Hammell,  View ORCID ProfileJordan D. Ward and  View ORCID ProfileDavid Q. Matus","*Department of Biochemistry and Cell Biology, Stony Brook University, Stony Brook, NY 11794,//†Cold Spring Harbor Laboratory, Cold Spring Harbor, NY 11724, and//‡Department of Molecular, Cell, and Developmental Biology, University of California-Santa Cruz, Santa Cruz, CA 95064","<U+21B5>1Corresponding author: 412 Life Sciences Building, Stony Brook University, Stony Brook, NY 11794. E-mail: david.matus{at}stonybrook.edu","david.matus@stonybrook.edu","January 1, 2020 ","AbstractAs developmental biologists in the age of genome editing, we now have access to an ever-increasing array of tools to manipulate endogenous gene expression. The auxin-inducible degradation system allows for spatial and temporal control of protein degradation via a hormone-inducible Arabidopsis F-box protein, transport inhibitor response 1 (TIR1). In the presence of auxin, TIR1 serves as a substrate-recognition component of the E3 ubiquitin ligase complex SKP1-CUL1-F-box (SCF), ubiquitinating auxin-inducible degron (AID)-tagged proteins for proteasomal degradation. Here, we optimize the Caenorhabditis elegans AID system by utilizing 1-naphthaleneacetic acid (NAA), an indole-free synthetic analog of the natural auxin indole-3-acetic acid (IAA). We take advantage of the photostability of NAA to demonstrate via quantitative high-resolution microscopy that rapid degradation of target proteins can be detected in single cells within 30 min of exposure. Additionally, we show that NAA works robustly in both standard growth media and physiological buffer. We also demonstrate that K-NAA, the water-soluble, potassium salt of NAA, can be combined with microfluidics for targeted protein degradation in C. elegans larvae. We provide insight into how the AID system functions in C. elegans by determining that TIR1 depends on C. elegans SKR-1/2, CUL-1, and RBX-1 to degrade target proteins. Finally, we present highly penetrant defects from NAA-mediated degradation of the FTZ-F1 nuclear hormone receptor, NHR-25, during C. elegans uterine-vulval development. Together, this work improves our use and understanding of the AID system for dissecting gene function at the single-cell level during C. elegans development.","C.,elegans,AID,system,synthetic,auxin,microfluidics,SCF,complex,NHR-25","https://www.g3journal.org/content/10/1/267.full"
"https://doi.org/10.1534/g3.113.006304 ","Editorial: HeLa Cell Sequela",NA,"",NA,"","June 1, 2013 ","NA","","https://www.g3journal.org/content/3/6/927.full"
"https://doi.org/10.1534/g3.113.005926 ","A Nucleosomal Region Important for Ensuring Proper Interactions Between the Transcription Elongation Factor Spt16 and Transcribed Genes in Saccharomyces cerevisiae","Hoai-Trang T. Nguyen, William Wharton, Jennifer A. Harper, James R. Dornhoffer and Andrea A. Duina","Biology Department, Hendrix College, Conway, Arkansas 72032","<U+21B5>1Corresponding author: Biology Department, Hendrix College, 1600 Washington Avenue, Conway, AR 72032. E-mail: duina{at}hendrix.edu","duina@hendrix.edu","June 1, 2013 ","AbstractThe highly conserved FACT (FAcilitates Chromatin Transactions) histone chaperone assists in the transcription elongation process first by facilitating the removal of histones in front of transcribing RNA polymerase II (Pol II) and then by contributing to nucleosome reassembly in the wake of Pol II passage. Whereas it is well established that FACT localizes across actively transcribed genes, the mechanisms that regulate FACT recruitment to and disengagement from chromatin during transcription still remain to be elucidated. Using the Saccharomyces cerevisiae model system, we previously showed that a histone H3 mutant—H3-L61W—greatly perturbs interactions between the yeast FACT (yFACT) complex and chromatin during transcription, resulting in a pronounced shift in yFACT occupancy toward the 3' ends of transcribed genes. In the present study we report that two histone H4 mutants—H4-R36A and H4-K31E—alter the association pattern of the yFACT subunit Spt16 across transcribed genes in a fashion similar to that seen for H3-L61W. Interestingly, H4-R36, H4-K31, and H3-L61 are in close proximity to each other on the side of the nucleosome. We also provide evidence that the H4-R36A and H3-L61W mutants impair proper Spt16-chromatin interactions by perturbing a common process. Collectively, our results suggest that a nucleosomal region encompassing the H4-R36, H4-K31, and H3-L61 residues plays an important role in ensuring proper association of yFACT across transcribed genes.","histones,nucleosomes,Spt16,yFACT,transcription,elongation","https://www.g3journal.org/content/3/6/929.full"
"https://doi.org/10.1534/g3.113.005785 ","Resistance to Germline RNA Interference in a Caenorhabditis elegans Wild Isolate Exhibits Complexity and Nonadditivity","Daniel A. Pollard and Matthew V. Rockman","Department of Biology, New York University, New York, NY 10003","<U+21B5>2Corresponding authors: 9500 Gilman Drive, #0116, San Diego, CA 92093. E-mail: dapollard{at}ucsd.edu; and 12 Waverly Place, New York, NY 10003. E-mail: mrockman{at}nyu.edu","dapollard@ucsd.edu;,mrockman@nyu.edu","June 1, 2013 ","AbstractResolving the genetic complexity of heritable phenotypic variation is fundamental to understanding the mechanisms of evolution and the etiology of human disease. Trait variation among isolates from genetically efficient model organisms offers the opportunity to dissect genetic architectures and identify the molecular mechanisms of causation. Here we present a genetic analysis of loss of sensitivity to gene knockdown via exogenous RNA interference in the germline of a wild isolate of the roundworm Caenorhabditis elegans. We find that the loss of RNA interference sensitivity in the wild isolate CB4856 is recessive to the sensitivity of the lab strain N2. A cross of the strains produced F2 with intermediate sensitivities, and the segregation of the trait among F2s strongly deviated from a single locus recessive allele expectation. Linkage analysis in recombinant inbred lines derived from CB4856 and N2 identified a single significant locus on chromosome I that includes the argonaute gene ppw-1. The alleles for ppw-1 were unable to explain the sensitivity of 18 (12.1%) of the recombinant inbred lines. Complementation tests and F2 segregation analysis of these recombinant inbred lines revealed cases of complex epistatic suppression and enhancement of the effects of ppw-1. We conclude that the variation in RNA interference sensitivity between CB4856 and N2 likely involves the nonadditive interactions of eight or more genes in addition to ppw-1.","QTL,epistasis,RNAi","https://www.g3journal.org/content/3/6/941.full"
"https://doi.org/10.1534/g3.112.005348 ","The Use of RelocaTE and Unassembled Short Reads to Produce High-Resolution Snapshots of Transposable Element Generated Diversity in Rice","Sofia M. C. Robb, Lu Lu, Elizabeth Valencia, James M. Burnette, Yutaka Okumoto, Susan R. Wessler and Jason E. Stajich","*Department of Plant Pathology & Microbiology, University of California-Riverside, California 92521//†Institute for Integrative Genome Biology, University of California-Riverside, California 92521//‡Department of Botany & Plant Sciences, University of California-Riverside, California 92521//§College of Natural and Agricultural Sciences, University of California-Riverside, California 92521//**Graduate School of Agriculture, Kyoto University, Kitashirakawa-oiwake Sakyo, Kyoto, Kyoto 606-8502, Japan","<U+21B5>1Corresponding author: Department of Plant Pathology & Microbiology, 900 University Avenue, University of California-Riverside, Riverside, CA 92521. E-mail: jason.stajich{at}ucr.edu","jason.stajich@ucr.edu","June 1, 2013 ","AbstractTransposable elements (TEs) are dynamic components of genomes that often vary in copy number among members of the same species. With the advent of next-generation sequencing TE insertion-site polymorphism can be examined at an unprecedented level of detail when combined with easy-to-use bioinformatics software. Here we report a new tool, RelocaTE, that rapidly identifies specific TE insertions that are either polymorphic or shared between a reference and unassembled next-generation sequencing reads. Furthermore, a novel companion tool, CharacTErizer, exploits the depth of coverage to classify genotypes of nonreference insertions as homozygous, heterozygous or, when analyzing an active TE family, as rare somatic insertion or excision events. It does this by comparing the numbers of RelocaTE aligned reads to reads that map to the same genomic position without the TE. Although RelocaTE and CharacTErizer can be used for any TE, they were developed to analyze the very active mPing element which is undergoing massive amplification in specific strains of Oryza sativa (rice). Three individuals of one of these strains, A123, were resequenced and analyzed for mPing insertion site polymorphisms. The majority of mPing insertions found (~97%) are not present in the reference, and two siblings from a self-crossed of this strain were found to share only ~90% of their insertions. Private insertions are primarily heterozygous but include both homozygous and predicted somatic insertions. The reliability of the predicted genotypes was validated by polymerase chain reaction.","transposable,element,rice,genomics,bioinformatics,NGS","https://www.g3journal.org/content/3/6/949.full"
