"DOI","Title","Authors","Author_Affiliations","Corresponding_Author","Corresponding_Authors_Email","Publication_Date","Abstract","Keywords","Full_Text"
"https://doi.org/10.1534/g3.113.007393 ","Functional Conservation of Gsdma Cluster Genes Specifically Duplicated in the Mouse Genome","Shigekazu Tanaka, Youichi Mizushina, Yoriko Kato, Masaru Tamura and Toshihiko Shiroishi","Mammalian Genetics Laboratory, Genetic Strains Research Center, National Institute of Genetics, 1111 Yata, Mishima, Shizuoka 411-8450, Japan","<U+21B5>2Corresponding author: Mammalian Genetics Laboratory, Genetic Strains Research Center, National Institute of Genetics. Yata-1111, Mishima, Shizuoka 411-8450, Japan. E-mail: tshirois{at}nig.ac.jp","tshirois@nig.ac.jp","October 1, 2013 ","AbstractMouse Gasdermin A3 (Gsdma3) is the causative gene for dominant skin mutations exhibiting alopecia. Mouse has two other Gsdma3-related genes, Gsdma and Gsdma2, whereas human and rat have only one related gene. To date, no skin mutation has been reported for human GSDMA and rat Gsdma as well as mouse Gsdma and Gsdma2. Therefore, it is possible that only Gsdma3 has gain-of-function type mutations to cause dominant skin phenotype. To elucidate functional divergence among the Gsdma-related genes in mice, and to infer the function of the human and rat orthologs, we examined in vivo function of mouse Gsdma by generating Gsdma knockout mice and transgenic mice that overexpress wild-type Gsdma or Gsdma harboring a point mutation (Alanine339Threonine). The Gsdma knockout mice shows no visible phenotype, indicating that Gsdma is not essential for differentiation of epidermal cells and maintenance of the hair cycle, and that Gsdma is expressed specifically both in the inner root sheath of hair follicles and in suprabasal cell layers, whereas Gsdma3 is expressed only in suprabasal layers. By contrast, both types of the transgenic mice exhibited epidermal hyperplasia resembling the Gsdma3 mutations, although the phenotype depended on the genetic background. These results indicate that the mouse Gsdma and Gsdma3 genes share common function to regulate epithelial maintenance and/or homeostasis, and suggest that the function of human GSDMA and rat Gsdma, which are orthologs of mouse Gsdma, is conserved as well.","Gasdermin,A,duplication,knockout,transgenic,alopecia","https://www.g3journal.org/content/3/10/1843.full"
"https://doi.org/10.1534/g3.113.007914 ","When Females Produce Sperm: Genetics of C. elegans Hermaphrodite Reproductive Choice","Adam K. Bahrami and Yun Zhang","Department of Organismic and Evolutionary Biology, Center for Brain Science, Harvard University, Cambridge, Massachusetts 02138","<U+21B5>1Corresponding author: Department of Organismic and Evolutionary Biology, Center for Brain Science, Harvard University, 52 Oxford St, Cambridge, Massachusetts 02138. E-mail: yzhang{at}oeb.harvard.edu","yzhang@oeb.harvard.edu","October 1, 2013 ","AbstractReproductive behaviors have manifold consequences on evolutionary processes. Here, we explore mechanisms underlying female reproductive choice in the nematode Caenorhabditis elegans, a species in which females have evolved the ability to produce their own self-fertilizing sperm, thereby allowing these ""hermaphrodites"" the strategic choice to self-reproduce or outcross with males. We report that hermaphrodites of the wild-type laboratory reference strain N2 favor self-reproduction, whereas a wild isolate CB4856 (HW) favors outcrossing. To characterize underlying neural mechanisms, we show that N2 hermaphrodites deficient in mechanosensation or chemosensation (e.g., mec-3 and osm-6 mutants) exhibit high mating frequency, implicating hermaphrodite perception of males as a requirement for low mating frequency. Within chemosensory networks, we find opposing roles for different sets of neurons that express the cyclic GMP-gated nucleotide channel, suggesting both positive and negative sensory-mediated regulation of hermaphrodite mating frequency. We also show that the ability to self-reproduce negatively regulates hermaphrodite mating. To map genetic variation, we created recombinant inbred lines and identified two QTL that explain a large portion of N2 × HW variation in hermaphrodite mating frequency. Intriguingly, we further show that ~40 wild isolates representing C. elegans global diversity exhibit extensive and continuous variation in hermaphrodite reproductive outcome. Together, our findings demonstrate that C. elegans hermaphrodites actively regulate the choice between selfing and crossing, highlight the existence of natural variation in hermaphrodite choice, and lay the groundwork for molecular dissection of this evolutionarily important trait.","QTL,genetic,basis,of,hermaphrodite,reproductive,strategy,natural,variation,neural,signaling","https://www.g3journal.org/content/3/10/1851.full"
"https://doi.org/10.1534/g3.113.007948 ","Practical Considerations Regarding the Use of Genotype and Pedigree Data to Model Relatedness in the Context of Genome-Wide Association Studies","Riyan Cheng, Clarissa C. Parker, Mark Abney and Abraham A. Palmer","*Department of Human Genetics, The University of Chicago, Illinois 60637//†Division of Plant Sciences, Research School of Biology, The Australian National University, Canberra, ACT 0200, Australia//‡Department of Psychiatry and Behavioral Neuroscience, The University of Chicago, Illinois 60637","<U+21B5>1Corresponding author: Department of Human Genetics, The University of Chicago, 920 E 58th Street, CLSC-507D, Chicago, IL 60637. E-mail: aap{at}uchicago.edu","aap@uchicago.edu","October 1, 2013 ","AbstractGenome-wide association studies of complex traits often are complicated by relatedness among individuals. Ignoring or inappropriately accounting for relatedness often results in inflated type I error rates. Either genotype or pedigree data can be used to estimate relatedness for use in mixed-models when undertaking quantitative trait locus mapping. We performed simulations to investigate methods for controlling type I error and optimizing power considering both full and partial pedigrees and, similarly, both sparse and dense marker coverage; we also examined real data sets. (1) When marker density was low, estimating relatedness by genotype data alone failed to control the type I error rate; (2) this was resolved by combining both genotype and pedigree data. (3) When sufficiently dense marker data were used to estimate relatedness, type I error was well controlled and power increased; however, (4) this was only true when the relatedness was estimated using genotype data that excluded genotypes on the chromosome currently being scanned for a quantitative trait locus.","quantitative,trait,locus,(QTL),relatedness,type,I,error,rate,statistical,power","https://www.g3journal.org/content/3/10/1861.full"
"https://doi.org/10.1534/g3.113.007187 ","Schizosaccharomyces japonicus Yeast Poised to Become a Favorite Experimental Organism for Eukaryotic Research","Amar J. S. Klar","Gene Regulation and Chromosome Biology Laboratory, National Cancer Institute, Center for Cancer Research, National Institutes of Health, Frederick, Maryland 21702-1201","<U+21B5>1Address for correspondence: Gene Regulation and Chromosome Biology Laboratory, National Cancer Institute, Center for Cancer Research, National Institutes of Health, Building 539, Room 154, Frederick, MD 21702-1201. E-mail: klara{at}mail.nih.gov","klara@mail.nih.gov","October 1, 2013 ","AbstractBoth budding yeast Saccharomyces cerevisiae and fission yeast Schizosaccahromyces pombe have been very popular organisms used for biological research with eukaryotes for many decades. Judging from the fission yeast Schizosaccharomyces japonicus DNA sequence determined 2 years ago, this species is evolutionarily very much unrelated to the commonly used yeasts for research. Indicating evolutionary divergence, the S. japonicus makes 8-spored asci and mitosis occurs with a partial breakdown of nuclear membrane whereas the other yeasts make 4-spored asci and cells divide without nuclear breakdown. The commonly used yeast species exhibit a generation time between 1.5 and 2.0 hr, and their genetic cross takes a period of more than 7 working d. As described here, a generation time of only 63 min and meiotic analysis completed in just 2.5 d, the S. japonicus fission yeast is predicted to become a choice organism for future research on the biology of eukaryotes.","Schizosaccharomyces,japonicus,fission,yeast,fast,growing,rapid,meiotic,analysis,organism,conducive,for,research","https://www.g3journal.org/content/3/10/1869.full"
"https://doi.org/10.1534/g3.113.007880 ","Drosophila Embryonic Cell-Cycle Mutants","Yingdee Unhavaithaya, Eugenia A. Park, Irena Royzman and Terry L. Orr-Weaver","*Whitehead Institute, Massachusetts Institute of Technology, Cambridge, Massachusetts 02142//†Department of Biology, Massachusetts Institute of Technology, Cambridge, Massachusetts 02142","<U+21B5>3Corresponding author: Whitehead Institute and Massachusetts Institute of Technology, Cambridge, MA 02142-1479. E-mail: weaver{at}wi.mit.edu","weaver@wi.mit.edu","October 1, 2013 ","AbstractNearly all cell division mutants in Drosophila were recovered in late larval/pupal lethal screens, with less than 10 embryonic lethal mutants identified, because larval development occurs without a requirement for cell division. Only cells in the nervous system and the imaginal cells that generate the adult body divide during larval stages, with larval tissues growing by increasing ploidy rather than cell number. Thus, most mutants perturbing mitosis or the cell cycle do not manifest a phenotype until the adult body differentiates in late larval and pupal stages. To identify cell-cycle components whose maternal pools are depleted in embryogenesis or that have specific functions in embryogenesis, we screened for mutants defective in cell division during embryogenesis. Five new alleles of Cyclin E were recovered, ranging from a missense mutation that is viable to stop codons causing embryonic lethality. These permitted us to investigate the requirements for Cyclin E function in neuroblast cell fate determination, a role previously shown for a null Cyclin E allele. The mutations causing truncation of the protein affect cell fate of the NB6-4 neuroblast, whereas the weak missense mutation has no effect. We identified mutations in the pavarotti (pav) and tumbleweed (tum) genes needed for cytokinesis by a phenotype of large and multinucleate cells in the embryonic epidermis and nervous system. Other mutations affecting the centromere protein CAL1 and the kinetochore protein Spc105R caused mitotic defects in the nervous system.","Drosophila,melanogaster,cell,cycle,pav,tum,cyclin,E,cal1,spc105R","https://www.g3journal.org/content/3/10/1875.full"
"https://doi.org/10.1534/g3.119.400541 ","Expression-Based Cell Lineage Analysis in Drosophila Through a Course-Based Research Experience for Early Undergraduates","John M. Olson, Cory J. Evans, Kathy T. Ngo, Hee Jong Kim, Joseph Duy Nguyen, Kayla G. H. Gurley, Truc Ta, Vijay Patel, Lisa Han, Khoa T. Truong-N, Letty Liang, Maggie K. Chu, Hiu Lam, Hannah G. Ahn, Abhik Kumar Banerjee, In Young Choi, Ross G. Kelley, Naseem Moridzadeh, Awais M. Khan, Omair Khan, Szuyao Lee, Elizabeth B. Johnson, Annie Tigranyan, Jay Wang, Anand D. Gandhi, Manish M. Padhiar, Joseph Hargan Calvopina, Kirandeep Sumra, Kristy Ou, Jessie C. Wu, Joseph N. Dickan, Sabrena M. Ahmadi, Donald N. Allen, Van Thanh Mai, Saif Ansari, George Yeh, Earl Yoon, Kimberly Gon, John Y. Yu, Johnny He, Jesse M. Zaretsky, Noemi E. Lee, Edward Kuoy, Alexander N. Patananan, Daniel Sitz, PhuongThao Tran, Minh-Tu Do, Samira J. Akhave, Silverio D. Alvarez, Bobby Asem, Neda Asem, Nicole A. Azarian, Arezou Babaesfahani, Ahmad Bahrami, Manjeet Bhamra, Ragini Bhargava, Rakesh Bhatia, Subir Bhatia, Nicholas Bumacod, Jonathan J. Caine, Thomas A. Caldwell, Nicole A. Calica, Elise M. Calonico, Carman Chan, Helen H.-L. Chan, Albert Chang, Chiaen Chang, Daniel Chang, Jennifer S. Chang, Nauman Charania, Jasmine Y. Chen, Kevin Chen, Lu Chen, Yuyu Chen, Derek J. Cheung, Jesse J. Cheung, Jessica J. Chew, Nicole B. Chew, Cheng-An Tony Chien, Alana M. Chin, Chee Jia Chin, Youngho Cho, Man Ting Chou, Ke-Huan K. Chow, Carolyn Chu, Derrick M. Chu, Virginia Chu, Katherine Chuang, Arunit Singh Chugh, Mark R. Cubberly, Michael Guillermo Daniel, Sangita Datta, Raj Dhaliwal, Jenny Dinh, Dhaval Dixit, Emmylou Dowling, Melinda Feng, Christopher M. From, Daisuke Furukawa, Himaja Gaddipati, Lilit Gevorgyan, Zunera Ghaznavi, Tulika Ghosh, Jaskaran Gill, David J. Groves, Kalkidan K. Gurara, Ali R. Haghighi, Alexandra L. Havard, Nasser Heyrani, Tanya Hioe, Kirim Hong, Justin J. Houman, Molly Howland, Elaine L. Hsia, Justin Hsueh, Stacy Hu, Andrew J. Huang, Jasmine C. Huynh, Jenny Huynh, Chris Iwuchukwu, Michael J. Jang, An An Jiang, Simran Kahlon, Pei-Yun Kao, Manpreet Kaur, Matthew G. Keehn, Elizabeth J. Kim, Hannah Kim, Michelle J. Kim, Shawn J. Kim, Aleksandar Kitich, Ross A. Kornberg, Nicholas G. Kouzelos, Jane Kuon, Bryan Lau, Roger K. Lau, Rona Law, Huy D. Le, Rachael Le, Carrou Lee, Christina Lee, Grace E. Lee, Kenny Lee, Michelle J. Lee, Regina V. Lee, Sean H. K. Lee, Sung Kyu Lee, Sung-Ling D. Lee, Yong Jun Lee, Megan J. Leong, David M. Li, Hao Li, Xingfu Liang, Eric Lin, Michelle M. Lin, Peter Lin, Tiffany Lin, Stacey Lu, Serena S. Luong, Jessica S. Ma, Li Ma, Justin N. Maghen, Sravya Mallam, Shivtaj Mann, Jason H. Melehani, Ryan C. Miller, Nitish Mittal, Carmel M. Moazez, Susie Moon, Rameen Moridzadeh, Kaley Ngo, Hanh H. Nguyen, Kambria Nguyen, Thien H. Nguyen, Angela W. Nieh, Isabella Niu, Seo-Kyung Oh, Jessica R. Ong, Randi K. Oyama, Joseph Park, Yaelim A. Park, Kimberly A. Passmore, Ami Patel, Amy A. Patel, Dhruv Patel, Tirth Patel, Katherine E. Peterson, An Huynh Pham, Steven V. Pham, Melissa E. Phuphanich, Neil D. Poria, Alexandra Pourzia, Victoria Ragland, Riki D. Ranat, Cameron M. Rice, David Roh, Solomon Rojhani, Lili Sadri, Agafe Saguros, Zainab Saifee, Manjot Sandhu, Brooke Scruggs, Lisa M. Scully, Vanessa Shih, Brian A. Shin, Tamir Sholklapper, Harnek Singh, Sumedha Singh, Sondra L. Snyder, Katelyn F. Sobotka, Sae Ho Song, Siddharth Sukumar, Halley C. Sullivan, Mark Sy, Hande Tan, Sara K. Taylor, Shivani K. Thaker, Tulsi Thakore, Gregory E. Tong, Jacinda N. Tran, Jonathan Tran, Tuan D. Tran, Vivi Tran, Cindy L. Trang, Hung G. Trinh, Peter Trinh, Han-Ching H. Tseng, Ted T. Uotani, Akram V. Uraizee, Kent K. T. Vu, Kevin K. T. Vu, Komal Wadhwani, Paluk K. Walia, Rebecca S. Wang, Shuo Wang, Stephanie J. Wang, Danica D. Wiredja, Andrew L. Wong, Daniel Wu, Xi Xue, Griselda Yanez, Yung-Hsuan Yang, Zhong Ye, Victor W. Yee, Cynthia Yeh, Yue Zhao, Xin Zheng, Anke Ziegenbalg, Jon Alkali, Ida Azizkhanian, Akash Bhakta, Luke Berry, Ryen Castillo, Sonja Darwish, Holly Dickinson, Ritika Dutta, Rahul Kumar Ghosh, Riley Guerin, Jonathan Hofman, Garrick Iwamoto, Sarah Kang, Andrew Kim, Brian Kim, Hanwool Kim, Kristine Kim, Suji Kim, Julie Ko, Michael Koenig, Alejandro LaRiviere, Clifton Lee, Jiwon Lee, Brandon Lung, Max Mittelman, Mark Murata, Yujin Park, Daniel Rothberg, Ben Sprung-Keyser, Kunal Thaker, Vivian Yip, Paul Picard, Francie Diep, Nikki Villarasa, Volker Hartenstein, Casey Shapiro, Marc Levis-Fitzgerald, Leslie Jaworski, David Loppato, Ira E. Clark and Utpal Banerjee","*Department of Molecular, Cell and Developmental Biology, University of California, Los Angeles, Los Angeles, CA 90095//†Biomedical Research Minor, University of California, Los Angeles//‡Loyola High School, Los Angeles, CA 90006//§Center for the Advancement of Teaching, University of California, Los Angeles, and//**Department of Psychology, Grinnell College, Grinnell, IA 50112","<U+21B5>4Corresponding authors: Department of Biology, Loyola Marymount University, 1 LMU Drive, Los Angeles, CA 90045, E-mail: Cory.Evans{at}lmu.edu. Department of Molecular, Cell, and Developmental Biology, University of California, Los Angeles, Los Angeles, CA 90095 Mail Code 723905. E-mail: banerjee{at}mbi.ucla.edu","Cory.Evans@lmu.edu.,banerjee@mbi.ucla.edu","November 1, 2019 ","AbstractA variety of genetic techniques have been devised to determine cell lineage relationships during tissue development. Some of these systems monitor cell lineages spatially and/or temporally without regard to gene expression by the cells, whereas others correlate gene expression with the lineage under study. The GAL4 Technique for Real-time and Clonal Expression (G-TRACE) system allows for rapid, fluorescent protein-based visualization of both current and past GAL4 expression patterns and is therefore amenable to genome-wide expression-based lineage screens. Here we describe the results from such a screen, performed by undergraduate students of the University of California, Los Angeles (UCLA) Undergraduate Research Consortium for Functional Genomics (URCFG) and high school summer scholars as part of a discovery-based education program. The results of the screen, which reveal novel expression-based lineage patterns within the brain, the imaginal disc epithelia, and the hematopoietic lymph gland, have been compiled into the G-TRACE Expression Database (GED), an online resource for use by the Drosophila research community. The impact of this discovery-based research experience on student learning gains was assessed independently and shown to be greater than that of similar programs conducted elsewhere. Furthermore, students participating in the URCFG showed considerably higher STEM retention rates than UCLA STEM students that did not participate in the URCFG, as well as STEM students nationwide.","G-TRACE,gene,expression,education,STEM,CURE","https://www.g3journal.org/content/9/11/3791.full"
"https://doi.org/10.1534/g3.116.027961 ","Sex Differences in Drosophila Somatic Gene Expression: Variation and Regulation by doublesex"," View ORCID ProfileMichelle N. Arbeitman, Felicia N. New, Justin M. Fear, Tiffany S. Howard, Justin E. Dalton and  View ORCID ProfileRita M. Graze","*Biomedical Sciences Department and Center for Genomics and Personalized Medicine, Florida State University, College of Medicine, Tallahassee, Florida 32306//†Department of Molecular Genetics and Microbiology, University of Florida, Gainesville, Florida 32610-0266//‡Department of Biological Sciences, Auburn University, Alabama 36849","<U+21B5>1Corresponding authors: Department of Biomedical Sciences, Florida State University, 1115 West Call Street, Tallahassee, FL 32306. E-mail: michelle.arbeitman{at}med.fsu.edu; and Department of Biological Sciences, 101 Rouse Life Sciences building, Auburn University, AL 36849-5407. E-mail: rmgraze{at}auburn.edu","michelle.arbeitman@med.fsu.edu;,rmgraze@auburn.edu","July 1, 2016 ","AbstractSex differences in gene expression have been widely studied in Drosophila melanogaster. Sex differences vary across strains, but many molecular studies focus on only a single strain, or on genes that show sexually dimorphic expression in many strains. How extensive variability is and whether this variability occurs among genes regulated by sex determination hierarchy terminal transcription factors is unknown. To address these questions, we examine differences in sexually dimorphic gene expression between two strains in Drosophila adult head tissues. We also examine gene expression in doublesex (dsx) mutant strains to determine which sex-differentially expressed genes are regulated by DSX, and the mode by which DSX regulates expression. We find substantial variation in sex-differential expression. The sets of genes with sexually dimorphic expression in each strain show little overlap. The prevalence of different DSX regulatory modes also varies between the two strains. Neither the patterns of DSX DNA occupancy, nor mode of DSX regulation explain why some genes show consistent sex-differential expression across strains. We find that the genes identified as regulated by DSX in this study are enriched with known sites of DSX DNA occupancy. Finally, we find that sex-differentially expressed genes and genes regulated by DSX are highly enriched on the fourth chromosome. These results provide insights into a more complete pool of potential DSX targets, as well as revealing the molecular flexibility of DSX regulation.","sex,determination,Drosophila,sex,hierarchy,doublesex,transcriptome,gene,expression,sex,bias,RNA-seq,Genetics,of,Sex","https://www.g3journal.org/content/6/7/1799.full"
"https://doi.org/10.1534/g3.111.000240 ","Stacks: Building and Genotyping Loci De Novo From Short-Read Sequences","Julian M. Catchen, Angel Amores, Paul Hohenlohe, William Cresko and John H. Postlethwait","*Center for Ecology and Evolutionary Biology//†Institute of Neuroscience, University of Oregon, Eugene, Oregon 97403","<U+21B5>1Corresponding author: Institute of Neuroscience, University of Oregon, Eugene, OR 97403. E-mail: jpostle{at}uoregon.edu","jpostle@uoregon.edu","August 1, 2011 ","AbstractAdvances in sequencing technology provide special opportunities for genotyping individuals with speed and thrift, but the lack of software to automate the calling of tens of thousands of genotypes over hundreds of individuals has hindered progress. Stacks is a software system that uses short-read sequence data to identify and genotype loci in a set of individuals either de novo or by comparison to a reference genome. From reduced representation Illumina sequence data, such as RAD-tags, Stacks can recover thousands of single nucleotide polymorphism (SNP) markers useful for the genetic analysis of crosses or populations. Stacks can generate markers for ultra-dense genetic linkage maps, facilitate the examination of population phylogeography, and help in reference genome assembly. We report here the algorithms implemented in Stacks and demonstrate their efficacy by constructing loci from simulated RAD-tags taken from the stickleback reference genome and by recapitulating and improving a genetic map of the zebrafish, Danio rerio.","Illumina,meiotic,linkage,map,RAD-seq,RAD-tag,zebrafish","https://www.g3journal.org/content/1/3/171.full"
"https://doi.org/10.1534/g3.119.400781 ","Rapid Degradation of Caenorhabditis elegans Proteins at Single-Cell Resolution with a Synthetic Auxin"," View ORCID ProfileMichael A. Q. Martinez, Brian A. Kinney,  View ORCID ProfileTaylor N. Medwig-Kinney, Guinevere Ashley, James M. Ragle,  View ORCID ProfileLonden Johnson,  View ORCID ProfileJoseph Aguilera, Christopher M. Hammell,  View ORCID ProfileJordan D. Ward and  View ORCID ProfileDavid Q. Matus","*Department of Biochemistry and Cell Biology, Stony Brook University, Stony Brook, NY 11794,//†Cold Spring Harbor Laboratory, Cold Spring Harbor, NY 11724, and//‡Department of Molecular, Cell, and Developmental Biology, University of California-Santa Cruz, Santa Cruz, CA 95064","<U+21B5>1Corresponding author: 412 Life Sciences Building, Stony Brook University, Stony Brook, NY 11794. E-mail: david.matus{at}stonybrook.edu","david.matus@stonybrook.edu","January 1, 2020 ","AbstractAs developmental biologists in the age of genome editing, we now have access to an ever-increasing array of tools to manipulate endogenous gene expression. The auxin-inducible degradation system allows for spatial and temporal control of protein degradation via a hormone-inducible Arabidopsis F-box protein, transport inhibitor response 1 (TIR1). In the presence of auxin, TIR1 serves as a substrate-recognition component of the E3 ubiquitin ligase complex SKP1-CUL1-F-box (SCF), ubiquitinating auxin-inducible degron (AID)-tagged proteins for proteasomal degradation. Here, we optimize the Caenorhabditis elegans AID system by utilizing 1-naphthaleneacetic acid (NAA), an indole-free synthetic analog of the natural auxin indole-3-acetic acid (IAA). We take advantage of the photostability of NAA to demonstrate via quantitative high-resolution microscopy that rapid degradation of target proteins can be detected in single cells within 30 min of exposure. Additionally, we show that NAA works robustly in both standard growth media and physiological buffer. We also demonstrate that K-NAA, the water-soluble, potassium salt of NAA, can be combined with microfluidics for targeted protein degradation in C. elegans larvae. We provide insight into how the AID system functions in C. elegans by determining that TIR1 depends on C. elegans SKR-1/2, CUL-1, and RBX-1 to degrade target proteins. Finally, we present highly penetrant defects from NAA-mediated degradation of the FTZ-F1 nuclear hormone receptor, NHR-25, during C. elegans uterine-vulval development. Together, this work improves our use and understanding of the AID system for dissecting gene function at the single-cell level during C. elegans development.","C.,elegans,AID,system,synthetic,auxin,microfluidics,SCF,complex,NHR-25","https://www.g3journal.org/content/10/1/267.full"
