"DOI","Title","Authors","Author_Affiliations","Corresponding_Author","Corresponding_Authors_Email","Publication_Date","Abstract","Keywords","Full_Text"
"https://doi.org/10.1534/g3.119.400541 ","Expression-Based Cell Lineage Analysis in Drosophila Through a Course-Based Research Experience for Early Undergraduates","John M. Olson, Cory J. Evans, Kathy T. Ngo, Hee Jong Kim, Joseph Duy Nguyen, Kayla G. H. Gurley, Truc Ta, Vijay Patel, Lisa Han, Khoa T. Truong-N, Letty Liang, Maggie K. Chu, Hiu Lam, Hannah G. Ahn, Abhik Kumar Banerjee, In Young Choi, Ross G. Kelley, Naseem Moridzadeh, Awais M. Khan, Omair Khan, Szuyao Lee, Elizabeth B. Johnson, Annie Tigranyan, Jay Wang, Anand D. Gandhi, Manish M. Padhiar, Joseph Hargan Calvopina, Kirandeep Sumra, Kristy Ou, Jessie C. Wu, Joseph N. Dickan, Sabrena M. Ahmadi, Donald N. Allen, Van Thanh Mai, Saif Ansari, George Yeh, Earl Yoon, Kimberly Gon, John Y. Yu, Johnny He, Jesse M. Zaretsky, Noemi E. Lee, Edward Kuoy, Alexander N. Patananan, Daniel Sitz, PhuongThao Tran, Minh-Tu Do, Samira J. Akhave, Silverio D. Alvarez, Bobby Asem, Neda Asem, Nicole A. Azarian, Arezou Babaesfahani, Ahmad Bahrami, Manjeet Bhamra, Ragini Bhargava, Rakesh Bhatia, Subir Bhatia, Nicholas Bumacod, Jonathan J. Caine, Thomas A. Caldwell, Nicole A. Calica, Elise M. Calonico, Carman Chan, Helen H.-L. Chan, Albert Chang, Chiaen Chang, Daniel Chang, Jennifer S. Chang, Nauman Charania, Jasmine Y. Chen, Kevin Chen, Lu Chen, Yuyu Chen, Derek J. Cheung, Jesse J. Cheung, Jessica J. Chew, Nicole B. Chew, Cheng-An Tony Chien, Alana M. Chin, Chee Jia Chin, Youngho Cho, Man Ting Chou, Ke-Huan K. Chow, Carolyn Chu, Derrick M. Chu, Virginia Chu, Katherine Chuang, Arunit Singh Chugh, Mark R. Cubberly, Michael Guillermo Daniel, Sangita Datta, Raj Dhaliwal, Jenny Dinh, Dhaval Dixit, Emmylou Dowling, Melinda Feng, Christopher M. From, Daisuke Furukawa, Himaja Gaddipati, Lilit Gevorgyan, Zunera Ghaznavi, Tulika Ghosh, Jaskaran Gill, David J. Groves, Kalkidan K. Gurara, Ali R. Haghighi, Alexandra L. Havard, Nasser Heyrani, Tanya Hioe, Kirim Hong, Justin J. Houman, Molly Howland, Elaine L. Hsia, Justin Hsueh, Stacy Hu, Andrew J. Huang, Jasmine C. Huynh, Jenny Huynh, Chris Iwuchukwu, Michael J. Jang, An An Jiang, Simran Kahlon, Pei-Yun Kao, Manpreet Kaur, Matthew G. Keehn, Elizabeth J. Kim, Hannah Kim, Michelle J. Kim, Shawn J. Kim, Aleksandar Kitich, Ross A. Kornberg, Nicholas G. Kouzelos, Jane Kuon, Bryan Lau, Roger K. Lau, Rona Law, Huy D. Le, Rachael Le, Carrou Lee, Christina Lee, Grace E. Lee, Kenny Lee, Michelle J. Lee, Regina V. Lee, Sean H. K. Lee, Sung Kyu Lee, Sung-Ling D. Lee, Yong Jun Lee, Megan J. Leong, David M. Li, Hao Li, Xingfu Liang, Eric Lin, Michelle M. Lin, Peter Lin, Tiffany Lin, Stacey Lu, Serena S. Luong, Jessica S. Ma, Li Ma, Justin N. Maghen, Sravya Mallam, Shivtaj Mann, Jason H. Melehani, Ryan C. Miller, Nitish Mittal, Carmel M. Moazez, Susie Moon, Rameen Moridzadeh, Kaley Ngo, Hanh H. Nguyen, Kambria Nguyen, Thien H. Nguyen, Angela W. Nieh, Isabella Niu, Seo-Kyung Oh, Jessica R. Ong, Randi K. Oyama, Joseph Park, Yaelim A. Park, Kimberly A. Passmore, Ami Patel, Amy A. Patel, Dhruv Patel, Tirth Patel, Katherine E. Peterson, An Huynh Pham, Steven V. Pham, Melissa E. Phuphanich, Neil D. Poria, Alexandra Pourzia, Victoria Ragland, Riki D. Ranat, Cameron M. Rice, David Roh, Solomon Rojhani, Lili Sadri, Agafe Saguros, Zainab Saifee, Manjot Sandhu, Brooke Scruggs, Lisa M. Scully, Vanessa Shih, Brian A. Shin, Tamir Sholklapper, Harnek Singh, Sumedha Singh, Sondra L. Snyder, Katelyn F. Sobotka, Sae Ho Song, Siddharth Sukumar, Halley C. Sullivan, Mark Sy, Hande Tan, Sara K. Taylor, Shivani K. Thaker, Tulsi Thakore, Gregory E. Tong, Jacinda N. Tran, Jonathan Tran, Tuan D. Tran, Vivi Tran, Cindy L. Trang, Hung G. Trinh, Peter Trinh, Han-Ching H. Tseng, Ted T. Uotani, Akram V. Uraizee, Kent K. T. Vu, Kevin K. T. Vu, Komal Wadhwani, Paluk K. Walia, Rebecca S. Wang, Shuo Wang, Stephanie J. Wang, Danica D. Wiredja, Andrew L. Wong, Daniel Wu, Xi Xue, Griselda Yanez, Yung-Hsuan Yang, Zhong Ye, Victor W. Yee, Cynthia Yeh, Yue Zhao, Xin Zheng, Anke Ziegenbalg, Jon Alkali, Ida Azizkhanian, Akash Bhakta, Luke Berry, Ryen Castillo, Sonja Darwish, Holly Dickinson, Ritika Dutta, Rahul Kumar Ghosh, Riley Guerin, Jonathan Hofman, Garrick Iwamoto, Sarah Kang, Andrew Kim, Brian Kim, Hanwool Kim, Kristine Kim, Suji Kim, Julie Ko, Michael Koenig, Alejandro LaRiviere, Clifton Lee, Jiwon Lee, Brandon Lung, Max Mittelman, Mark Murata, Yujin Park, Daniel Rothberg, Ben Sprung-Keyser, Kunal Thaker, Vivian Yip, Paul Picard, Francie Diep, Nikki Villarasa, Volker Hartenstein, Casey Shapiro, Marc Levis-Fitzgerald, Leslie Jaworski, David Loppato, Ira E. Clark and Utpal Banerjee","*Department of Molecular, Cell and Developmental Biology, University of California, Los Angeles, Los Angeles, CA 90095//†Biomedical Research Minor, University of California, Los Angeles//‡Loyola High School, Los Angeles, CA 90006//§Center for the Advancement of Teaching, University of California, Los Angeles, and//**Department of Psychology, Grinnell College, Grinnell, IA 50112","<U+21B5>4Corresponding authors: Department of Biology, Loyola Marymount University, 1 LMU Drive, Los Angeles, CA 90045, E-mail: Cory.Evans{at}lmu.edu. Department of Molecular, Cell, and Developmental Biology, University of California, Los Angeles, Los Angeles, CA 90095 Mail Code 723905. E-mail: banerjee{at}mbi.ucla.edu","Cory.Evans@lmu.edu.,banerjee@mbi.ucla.edu","November 1, 2019 ","AbstractA variety of genetic techniques have been devised to determine cell lineage relationships during tissue development. Some of these systems monitor cell lineages spatially and/or temporally without regard to gene expression by the cells, whereas others correlate gene expression with the lineage under study. The GAL4 Technique for Real-time and Clonal Expression (G-TRACE) system allows for rapid, fluorescent protein-based visualization of both current and past GAL4 expression patterns and is therefore amenable to genome-wide expression-based lineage screens. Here we describe the results from such a screen, performed by undergraduate students of the University of California, Los Angeles (UCLA) Undergraduate Research Consortium for Functional Genomics (URCFG) and high school summer scholars as part of a discovery-based education program. The results of the screen, which reveal novel expression-based lineage patterns within the brain, the imaginal disc epithelia, and the hematopoietic lymph gland, have been compiled into the G-TRACE Expression Database (GED), an online resource for use by the Drosophila research community. The impact of this discovery-based research experience on student learning gains was assessed independently and shown to be greater than that of similar programs conducted elsewhere. Furthermore, students participating in the URCFG showed considerably higher STEM retention rates than UCLA STEM students that did not participate in the URCFG, as well as STEM students nationwide.","G-TRACE,gene,expression,education,STEM,CURE","https://www.g3journal.org/content/9/11/3791.full"
"https://doi.org/10.1534/g3.116.027961 ","Sex Differences in Drosophila Somatic Gene Expression: Variation and Regulation by doublesex"," View ORCID ProfileMichelle N. Arbeitman, Felicia N. New, Justin M. Fear, Tiffany S. Howard, Justin E. Dalton and  View ORCID ProfileRita M. Graze","*Biomedical Sciences Department and Center for Genomics and Personalized Medicine, Florida State University, College of Medicine, Tallahassee, Florida 32306//†Department of Molecular Genetics and Microbiology, University of Florida, Gainesville, Florida 32610-0266//‡Department of Biological Sciences, Auburn University, Alabama 36849","<U+21B5>1Corresponding authors: Department of Biomedical Sciences, Florida State University, 1115 West Call Street, Tallahassee, FL 32306. E-mail: michelle.arbeitman{at}med.fsu.edu; and Department of Biological Sciences, 101 Rouse Life Sciences building, Auburn University, AL 36849-5407. E-mail: rmgraze{at}auburn.edu","michelle.arbeitman@med.fsu.edu;,rmgraze@auburn.edu","July 1, 2016 ","AbstractSex differences in gene expression have been widely studied in Drosophila melanogaster. Sex differences vary across strains, but many molecular studies focus on only a single strain, or on genes that show sexually dimorphic expression in many strains. How extensive variability is and whether this variability occurs among genes regulated by sex determination hierarchy terminal transcription factors is unknown. To address these questions, we examine differences in sexually dimorphic gene expression between two strains in Drosophila adult head tissues. We also examine gene expression in doublesex (dsx) mutant strains to determine which sex-differentially expressed genes are regulated by DSX, and the mode by which DSX regulates expression. We find substantial variation in sex-differential expression. The sets of genes with sexually dimorphic expression in each strain show little overlap. The prevalence of different DSX regulatory modes also varies between the two strains. Neither the patterns of DSX DNA occupancy, nor mode of DSX regulation explain why some genes show consistent sex-differential expression across strains. We find that the genes identified as regulated by DSX in this study are enriched with known sites of DSX DNA occupancy. Finally, we find that sex-differentially expressed genes and genes regulated by DSX are highly enriched on the fourth chromosome. These results provide insights into a more complete pool of potential DSX targets, as well as revealing the molecular flexibility of DSX regulation.","sex,determination,Drosophila,sex,hierarchy,doublesex,transcriptome,gene,expression,sex,bias,RNA-seq,Genetics,of,Sex","https://www.g3journal.org/content/6/7/1799.full"
"https://doi.org/10.1534/g3.111.000240 ","Stacks: Building and Genotyping Loci De Novo From Short-Read Sequences","Julian M. Catchen, Angel Amores, Paul Hohenlohe, William Cresko and John H. Postlethwait","*Center for Ecology and Evolutionary Biology//†Institute of Neuroscience, University of Oregon, Eugene, Oregon 97403","<U+21B5>1Corresponding author: Institute of Neuroscience, University of Oregon, Eugene, OR 97403. E-mail: jpostle{at}uoregon.edu","jpostle@uoregon.edu","August 1, 2011 ","AbstractAdvances in sequencing technology provide special opportunities for genotyping individuals with speed and thrift, but the lack of software to automate the calling of tens of thousands of genotypes over hundreds of individuals has hindered progress. Stacks is a software system that uses short-read sequence data to identify and genotype loci in a set of individuals either de novo or by comparison to a reference genome. From reduced representation Illumina sequence data, such as RAD-tags, Stacks can recover thousands of single nucleotide polymorphism (SNP) markers useful for the genetic analysis of crosses or populations. Stacks can generate markers for ultra-dense genetic linkage maps, facilitate the examination of population phylogeography, and help in reference genome assembly. We report here the algorithms implemented in Stacks and demonstrate their efficacy by constructing loci from simulated RAD-tags taken from the stickleback reference genome and by recapitulating and improving a genetic map of the zebrafish, Danio rerio.","Illumina,meiotic,linkage,map,RAD-seq,RAD-tag,zebrafish","https://www.g3journal.org/content/1/3/171.full"
"https://doi.org/10.1534/g3.119.400781 ","Rapid Degradation of Caenorhabditis elegans Proteins at Single-Cell Resolution with a Synthetic Auxin"," View ORCID ProfileMichael A. Q. Martinez, Brian A. Kinney,  View ORCID ProfileTaylor N. Medwig-Kinney, Guinevere Ashley, James M. Ragle,  View ORCID ProfileLonden Johnson,  View ORCID ProfileJoseph Aguilera, Christopher M. Hammell,  View ORCID ProfileJordan D. Ward and  View ORCID ProfileDavid Q. Matus","*Department of Biochemistry and Cell Biology, Stony Brook University, Stony Brook, NY 11794,//†Cold Spring Harbor Laboratory, Cold Spring Harbor, NY 11724, and//‡Department of Molecular, Cell, and Developmental Biology, University of California-Santa Cruz, Santa Cruz, CA 95064","<U+21B5>1Corresponding author: 412 Life Sciences Building, Stony Brook University, Stony Brook, NY 11794. E-mail: david.matus{at}stonybrook.edu","david.matus@stonybrook.edu","January 1, 2020 ","AbstractAs developmental biologists in the age of genome editing, we now have access to an ever-increasing array of tools to manipulate endogenous gene expression. The auxin-inducible degradation system allows for spatial and temporal control of protein degradation via a hormone-inducible Arabidopsis F-box protein, transport inhibitor response 1 (TIR1). In the presence of auxin, TIR1 serves as a substrate-recognition component of the E3 ubiquitin ligase complex SKP1-CUL1-F-box (SCF), ubiquitinating auxin-inducible degron (AID)-tagged proteins for proteasomal degradation. Here, we optimize the Caenorhabditis elegans AID system by utilizing 1-naphthaleneacetic acid (NAA), an indole-free synthetic analog of the natural auxin indole-3-acetic acid (IAA). We take advantage of the photostability of NAA to demonstrate via quantitative high-resolution microscopy that rapid degradation of target proteins can be detected in single cells within 30 min of exposure. Additionally, we show that NAA works robustly in both standard growth media and physiological buffer. We also demonstrate that K-NAA, the water-soluble, potassium salt of NAA, can be combined with microfluidics for targeted protein degradation in C. elegans larvae. We provide insight into how the AID system functions in C. elegans by determining that TIR1 depends on C. elegans SKR-1/2, CUL-1, and RBX-1 to degrade target proteins. Finally, we present highly penetrant defects from NAA-mediated degradation of the FTZ-F1 nuclear hormone receptor, NHR-25, during C. elegans uterine-vulval development. Together, this work improves our use and understanding of the AID system for dissecting gene function at the single-cell level during C. elegans development.","C.,elegans,AID,system,synthetic,auxin,microfluidics,SCF,complex,NHR-25","https://www.g3journal.org/content/10/1/267.full"
"https://doi.org/10.1534/g3.112.005017 ","Strain Specific Genotype-Environment Interactions and Evolutionary Potential for Body Mass in Brook Charr (Salvelinus fontinalis)","Amélie Crespel, Louis Bernatchez, Céline Audet and Dany Garant","*Institut des Sciences de la Mer de Rimouski, Université du Québec à Rimouski, Rimouski, QC, G5L 3A1, Canada//†Institut de Biologie Intégrative et des Systèmes, Département de biologie, Université Laval, Québec City, QC, G1V 0A6, Canada//‡Département de biologie, Université de Sherbrooke, Sherbrooke, QC, J1K 2R1, Canada","<U+21B5>1Corresponding author: Institut des Sciences de la Mer de Rimouski, Université du Québec à Rimouski, 310 allée des Ursulines, Rimouski, Québec, G5L 3A1, Canada. E-mail: celine_audet{at}uqar.qc.ca","celine_audet@uqar.qc.ca","March 1, 2013 ","AbstractDiscriminating between genetic and environmental causes of phenotypic variation is an essential requirement for understanding the evolutionary potential of populations. However, the extent to which genetic variation differs among conspecific groups and environments during ontogeny has rarely been investigated. In this study, the genetic basis of body mass was measured in three divergent strains of brook charr (Salvelinus fontinalis) in different rearing environments and at different time periods. The results indicate that body mass was a heritable trait in all strains but that the level of heritability greatly differed among strains. Moreover, heritability estimates of each strain varied differently according to environmental rearing conditions, and cross-environments correlations were all significantly lower than unity, indicating strain-specific patterns of genotype–environment interactions. Heritability estimates also varied throughout ontogeny and decreased by 50% from 9 to 21 months of age. This study highlights the divergence in genetic architecture and evolutionary potential among these strains and emphasizes the importance of considering the strain-specific potential of the response to selection according to environmental variation.","heritability,evolutionary,potential,gene-environment,interactions,genetic,architecture,strains","https://www.g3journal.org/content/3/3/379.full"
"https://doi.org/10.1534/g3.112.004812 ","Accurate Identification and Analysis of Human mRNA Isoforms Using Deep Long Read Sequencing","Hagen Tilgner, Debasish Raha, Lukas Habegger, Mohammed Mohiuddin, Mark Gerstein and Michael Snyder","*Department of Genetics, Stanford University, Stanford, California 94305//†Department of Molecular, Cellular and Developmental Biology, Yale University, New Haven, Connecticut 06120//‡Program in Computational Biology and Department of Molecular Biophysics and Biochemistry, Yale University, New Haven, Connecticut 06120//§Roche, Branford, Connecticut 06405","<U+21B5>1Corresponding author: Stanford University, Department of Genetics, MC: 5120, 300 Pasteur Dr., M-344, Stanford, CA 94305-5120. E-mail: mpsnyder{at}stanford.edu","mpsnyder@stanford.edu","March 1, 2013 ","AbstractPrecise identification of RNA-coding regions and transcriptomes of eukaryotes is a significant problem in biology. Currently, eukaryote transcriptomes are analyzed using deep short-read sequencing experiments of complementary DNAs. The resulting short-reads are then aligned against a genome and annotated junctions to infer biological meaning. Here we use long-read complementary DNA datasets for the analysis of a eukaryotic transcriptome and generate two large datasets in the human K562 and HeLa S3 cell lines. Both data sets comprised at least 4 million reads and had median read lengths greater than 500 bp. We show that annotation-independent alignments of these reads provide partial gene structures that are very much in-line with annotated gene structures, 15% of which have not been obtained in a previous de novo analysis of short reads. For long-noncoding RNAs (i.e., lncRNA) genes, however, we find an increased fraction of novel gene structures among our alignments. Other important aspects of transcriptome analysis, such as the description of cell type-specific splicing, can be performed in an accurate, reliable and completely annotation-free manner, making it ideal for the analysis of transcriptomes of newly sequenced genomes. Furthermore, we demonstrate that long read sequence can be assembled into full-length transcripts with considerable success. Our method is applicable to all long read sequencing technologies.","RNA,Roche,sequencing,human,splicing,transcriptome","https://www.g3journal.org/content/3/3/387.full"
"https://doi.org/10.1534/g3.112.005355 ","On the Mutational Topology of the Bacterial Genome","Patricia L. Foster, Andrew J. Hanson, Heewook Lee, Ellen M. Popodi and Haixu Tang","*Department of Biology, Indiana University, Bloomington, Indiana 47405//†School of Informatics and Computing, Indiana University, Bloomington, Indiana 47405","<U+21B5>1Corresponding author: Department of Biology, 1001 East Third Street, Indiana University, Bloomington, IN 47405. E-mail: plfoster{at}indiana.edu","plfoster@indiana.edu","March 1, 2013 ","AbstractBy sequencing the genomes of 34 mutation accumulation lines of a mismatch-repair defective strain of Escherichia coli that had undergone a total of 12,750 generations, we identified 1625 spontaneous base-pair substitutions spread across the E. coli genome. These mutations are not distributed at random but, instead, fall into a wave-like spatial pattern that is repeated almost exactly in mirror image in the two separately replicated halves of the bacterial chromosome. The pattern is correlated to genomic features, with mutation densities greatest in regions predicted to have high superhelicity. Superimposed upon this pattern are regional hotspots, some of which are located where replication forks may collide or be blocked. These results suggest that, as they traverse the chromosome, the two replication forks encounter parallel structural features that change the fidelity of DNA replication.","mutation,rate,evolution,replication,fidelity,chromosome,structure,DNA,polymerase,errors","https://www.g3journal.org/content/3/3/399.full"
"https://doi.org/10.1534/g3.112.004747 ","A Mosaic Genetic Screen for Genes Involved in the Early Steps of Drosophila Oogenesis","Marlène Jagut, Ludivine Mihaila-Bodart, Anahi Molla-Herman, Marie-Françoise Alin, Jean-Antoine Lepesant and Jean-René Huynh","*Institut Curie, Department of Genetics and Developmental Biology (CNRS-UMR3215, Inserm-U934), 75248 Paris, Cedex 05, France//†Institut Jacques Monod, CNRS-Universite Paris Diderot, 75205 Paris, Cedex 13, France","<U+21B5>1Corresponding author: Institut Curie, Department of Genetics and Developmental Biology (CNRS-UMR3215, Inserm-U934), 26 rue d’Ulm, 75248 Paris, Cedex 05, France. E-mail: jean-rene.huynh{at}curie.fr","jean-rene.huynh@curie.fr","March 1, 2013 ","AbstractThe first hours of Drosophila embryogenesis rely exclusively on maternal information stored within the egg during oogenesis. The formation of the egg chamber is thus a crucial step for the development of the future adult. It has emerged that many key developmental decisions are made during the very first stages of oogenesis. We performed a clonal genetic screen on the left arm of chromosome 2 for mutations affecting early oogenesis. During the first round of screening, we scored for defects in egg chambers morphology as an easy read-out of early abnormalities. In a second round of screening, we analyzed the localization of centrosomes and Orb protein within the oocyte, the position of the oocyte within the egg chamber, and the progression through meiosis. We have generated a collection of 71 EMS-induced mutants that affect oocyte determination, polarization, or localization. We also recovered mutants affecting the number of germline cyst divisions or the differentiation of follicle cells. Here, we describe the analysis of nine complementation groups and eight single alleles. We mapped several mutations and identified alleles of Bicaudal-D, lethal(2) giant larvae, kuzbanian, GDP-mannose 4,6-dehydratase, tho2, and eiF4A. We further report the molecular identification of two alleles of the Drosophila homolog of Che-1/AATF and demonstrate its antiapoptotic activity in vivo. This collection of mutants will be useful to investigate further the early steps of Drosophila oogenesis at a genetic level.","Apoptosis,Drosophila,Germ,cells,Mutagenesis,Oogenesis","https://www.g3journal.org/content/3/3/409.full"
"https://doi.org/10.1534/g3.112.005363 ","Imputation of Unordered Markers and the Impact on Genomic Selection Accuracy","Jessica E. Rutkoski, Jesse Poland, Jean-Luc Jannink and Mark E. Sorrells","*Department of Plant Breeding and Genetics, Cornell University, Ithaca New York, 14853//†Department of Agronomy, Kansas State University, Manhattan, Kansas 66506//‡United States Department of Agriculture-Agricultural Research Service (USDA-ARS), Manhattan, Kansas 66502//§USDA-ARS, Ithaca, New York 14853","<U+21B5>1Corresponding author: Department of Plant Breeding and Genetics, 240 Emerson Hall, Cornell, Ithaca, NY 14853-1902. E-mail: mes12{at}cornell.edu","mes12@cornell.edu","March 1, 2013 ","AbstractGenomic selection, a breeding method that promises to accelerate rates of genetic gain, requires dense, genome-wide marker data. Genotyping-by-sequencing can generate a large number of de novo markers. However, without a reference genome, these markers are unordered and typically have a large proportion of missing data. Because marker imputation algorithms were developed for species with a reference genome, algorithms suited for unordered markers have not been rigorously evaluated. Using four empirical datasets, we evaluate and characterize four such imputation methods, referred to as k-nearest neighbors, singular value decomposition, random forest regression, and expectation maximization imputation, in terms of their imputation accuracies and the factors affecting accuracy. The effect of imputation method on the genomic selection accuracy is assessed in comparison with mean imputation. The effect of excluding markers with a large proportion of missing data on the genomic selection accuracy is also examined. Our results show that imputation of unordered markers can be accurate, especially when linkage disequilibrium between markers is high and genotyped individuals are related. Of the methods evaluated, random forest regression imputation produced superior accuracy. In comparison with mean imputation, all four imputation methods we evaluated led to greater genomic selection accuracies when the level of missing data was high. Including rather than excluding markers with a large proportion of missing data nearly always led to greater GS accuracies. We conclude that high levels of missing data in dense marker sets is not a major obstacle for genomic selection, even when marker order is not known.","genomic,selection,imputation,algorithms,genotyping-by-sequencing,GenPred,Shared,data,resources","https://www.g3journal.org/content/3/3/427.full"
